{
  "$schema": "https://json-schema.org/draft/2020-12/schema",
  "$id": "https://omniproject.dev/assets/task-context-vocabulary.schema.json",
  "title": "OmniProject GTD task-context vocabulary entry",
  "description": "One canonical GTD @context (David Allen's \"where / with what tool can I do this\" axis — a FLAT set, unlike the ordinal energy/severity axes), authored as a single JSON array (assets/task-context-vocabulary.json), validated element-by-element against this schema and embedded by gen-task-context-vocabulary. A context has a display `order` but no internal ordinal `level` — it is a set, not a scale.",
  "type": "object",
  "additionalProperties": false,
  "required": ["id", "label", "order"],
  "properties": {
    "id": { "type": "string", "pattern": "^[a-z][a-z0-9_]*$" },
    "label": { "type": "string", "minLength": 1, "description": "The base/default label (the authoring language)." },
    "labels": {
      "type": "object",
      "description": "Optional per-locale translations of the label (BCP-47 key → text). A viewer sees labels[theirLocale] ?? labels[lang] ?? label.",
      "propertyNames": { "pattern": "^[a-z]{2}(-[A-Za-z0-9]{2,8})?$" },
      "additionalProperties": { "type": "string", "minLength": 1 }
    },
    "order": { "type": "integer", "minimum": 0, "description": "Display position — the only ordinal a context carries (there is no internal `level`; contexts are an unordered set)." },
    "color": { "type": "string", "pattern": "^#[0-9a-fA-F]{6}$", "description": "Swatch colour as a 6-digit hex (rendered via inline style). Absent ⇒ a neutral swatch." },
    "methodologies": {
      "type": "array",
      "items": { "type": "string" },
      "description": "Methodology tags this context belongs to ('*' = neutral / all). Absent ⇒ neutral."
    }
  }
}
